,Title,Published_date,Views,Comments,Month
313,How to Build a Great Resume to Get Hired in Tech,2022-07-11,9802,33,Jul
314,Second Year College Roadmap (BTech/BCA),2022-07-09,59841,238,Jul
315,KubeCon North America 🇺🇸 Travel Scholarship Giveaway! ✈️,2022-07-01,14176,94,Jul
316,Microsoft Engage Controversy - Internship Without Interview?,2022-06-30,48231,335,Jun
317,First Year College Roadmap (BTech/BCA),2022-06-29,86029,373,Jun
318,10 Ways College Students Get Scammed in India,2022-06-27,70845,541,Jun
319,Managing Kubernetes Manifests at Scale - Twitter Space,2022-06-27,1929,9,Jun
320,Cracked Amazon Dublin 1.2 Cr Package From Tier-3 College Electronics Branch,2022-06-24,112388,382,Jun
321,Secure API Access To Kubernetes Control Plane with Sakshyam Shah from @goteleport,2022-06-22,2441,9,Jun
322,How Much Tax Do Remote Workers Pay From 🇮🇳 - Featuring Google Guest! 😱,2022-06-19,76911,224,Jun
323,Code Quality and Reviews Best Practices,2022-06-18,3460,7,Jun
324,Modern Application Permissions Best Practices - Twitter Space,2022-06-17,2006,5,Jun
325,Ensure Infrastructure as Code Best Practices With ValidIaC,2022-06-16,5199,24,Jun
326,How I Learned So Many Tech Stacks in Freshman Year,2022-06-15,96784,236,Jun
327,Remote Work Best Practices - Twitter Space,2022-06-14,10919,31,Jun
328,What I Learned Conducting 3000+ MLH Fellowship Evaluations + Interviews,2022-06-12,26955,82,Jun
329,Container Management Made Easy With Portainer,2022-06-10,1891,6,Jun
330,Secure Your APIs With Cherrybomb by BLST + Docs Made Easy!,2022-06-09,5295,20,Jun
331,The Most Difficult Programming Language to Learn,2022-06-08,31133,170,Jun
332,Not From IIT? Here's How to Eliminate Career Discriminations From Tier-3 College,2022-06-06,44118,276,Jun
333,Common Authorization Vulnerabilities and Best Practices,2022-06-01,3208,8,Jun
334,Don't Use DSA Questions Sheets for Interview Preparation!,2022-05-31,125527,322,May
335,"Hashnode Blogging Challenges - Learn & Win MacBooks, iPads, Swag & More Every Month!",2022-05-27,6532,49,May
336,Do Companies Hire DevOps Freshers?,2022-05-25,63233,242,May
337,Career Paths After B-tech/BCA/BSc - Salary Comparisons + Prerequisites + Placement Tips,2022-05-22,47833,283,May
338,Achieving NSA Kubernetes Hardening Guidelines With Datree,2022-05-15,5501,18,May
339,Find Kubernetes Misconfigurations While Coding With Datree's VS Code Extension,2022-05-11,5858,22,May
340,A Guide to Kubernetes Troubleshooting,2022-05-04,2617,8,May
341,Why I Prefer Twitter Over LinkedIn,2022-05-02,20402,69,May
342,Communication Best Practices - Giving and Receiving Feedback,2022-05-01,3439,10,May
343,Multi-cluster Management With KubeSphere on Civo,2022-04-28,4378,14,Apr
344,"Introduction to @goteleport - the Easiest, Most Secure Way to Access Infrastructure",2022-04-27,3789,4,Apr
345,Container Management Made Easy With Portainer,2022-04-26,4454,8,Apr
346,Monitor and Reduce Kubernetes Spend With Kubecost,2022-04-25,6014,10,Apr
347,"Datree CLI GitHub Actions Tutorial - Environments, Secrets, and More!",2022-04-24,3657,9,Apr
348,KubeSphere: One Kubernetes Platform for Full Stack Solutions & Management,2022-04-23,5604,7,Apr
349,Utilising Open Source for Career Advancement,2022-04-23,2668,16,Apr
350,Introduction to GitHub Actions CI/CD,2022-04-21,19340,32,Apr
351,Learning in Public for Career Advancement,2022-04-20,3637,10,Apr
352,Introduction to CNCF + Getting Involved - with Priyanka Sharma,2022-04-19,12082,17,Apr
353,"Prevent Argo CD Misconfigurations With Datree - Rollouts, Workflows, and More!",2022-04-17,11689,17,Apr
354,"Introduction to Argo CD & GitOps - With Datree, Lens & Civo Examples",2022-04-14,12507,30,Apr
355,Testkube: Your Friendly Cloud-Native Testing Framework for Kubernetes,2022-04-13,2678,22,Apr
356,Does a Degree Determine One's Fate? How to Get Hired in Tech,2022-04-10,5588,20,Apr
357,Getting Started With Kustomize With Datree Examples,2022-03-29,7644,23,Mar
358,Win Apple iPads and Swag - Kubernetes Security Week by Kubescape 🔒,2022-03-24,5283,18,Mar
359,"Validate, Clean & Secure Your Kubernetes Yaml With Validkube",2022-03-23,7779,24,Mar
360,Hacking Around the World - a Complete Guide to Hackathons,2022-03-11,9036,13,Mar
361,Open Source to Bloomberg London (Off Campus) - Giveaway Announcement 🏆,2022-03-06,15500,31,Mar
362,Contributing to the Cloud Native Glossary Open Source - No Coding Required,2022-03-03,8061,17,Mar
363,Test Resources Within the Cluster With Datree's Kubectl Plugin,2022-02-28,3653,8,Feb
364,How to Be a GOAT Student? My Top 4 Career Tips 🏆,2022-02-26,50971,210,Feb
365,Secure Your Kubernetes Clusters With Kubescape By Armosec,2022-02-25,9707,9,Feb
366,Git Hooks Tutorial - Practical Examples with Datree,2022-02-23,11621,19,Feb
367,TwilioQuest Winners Announcement - Win KCNA Vouchers & Twilio Swag Bundles 🤩,2022-02-22,2686,11,Feb
368,Find Kubernetes Security Issues While Coding With Kubescape,2022-02-21,3840,4,Feb
369,YAML Manifest Templates in Monokle - KCNA Course Giveaway Worth $299 🎉,2022-02-18,10188,27,Feb
370,Travel The World While Freelancing - How To Get Started?,2022-02-17,9210,35,Feb
371,What's New in Monokle? Easily Manage Kubernetes Manifests,2022-02-15,3610,7,Feb
372,An Overview to Cloud Native Security with Sakshyam Shah from @goteleport,2022-02-14,2675,8,Feb
373,Kubernetes Tutorial for Beginners | What is Kubernetes? Architecture Simplified!,2022-02-12,139177,201,Feb
374,"Scaling Products - How Lens Grew to 500,000 Monthly Active Users",2022-02-11,2311,13,Feb
375,Docker Tutorial for Beginners - What is Docker? Introduction to Containers,2022-02-09,215254,303,Feb
376,"""I Quit My Job to Do Open Source Full Time"" - Josh's Story",2022-02-09,7343,24,Feb
377,Manage and Debug Kubernetes Manifests with Monokle by Kubeshop,2022-01-28,21243,75,Jan
378,Managing Kubernetes Clusters with Lens - Best K8s Dashboard & IDE for DevOps,2022-01-27,26213,60,Jan
379,Complete YAML Course - Beginner to Advanced for DevOps and more!,2022-01-24,201305,283,Jan
380,Adding Custom Rules in Datree - Prevent Kubernetes Misconfigurations,2022-01-24,20082,26,Jan
381,Introduction to Linux & Terminal Commands - Full Course for Beginners,2022-01-23,263018,417,Jan
382,How to be a Good Software Engineer with Kelsey Hightower,2022-01-21,41614,41,Jan
383,Working with Datree’s Helm Plugin - Prevent Kubernetes Misconfigurations,2022-01-21,28971,16,Jan
384,Future of Open Source in Education with Joe Nash,2022-01-20,6262,38,Jan
385,Computer Networking Full Course - OSI Model Deep Dive with Real Life Examples,2022-01-17,1162624,1525,Jan
386,How to Understand Large Codebases in Open Source?,2022-01-13,62251,103,Jan
387,How to Find Good First Issues in Open Source?,2022-01-12,54776,83,Jan
388,Learn Programming via Gaming with TwilioQuest - Win Exciting Prizes!,2022-01-11,24805,87,Jan
389,Best Advice for College Students,2022-01-09,13240,36,Jan
390,GitHub Campus Experts Program Explained in 2 Minutes,2022-01-08,10609,27,Jan
391,Best Data Structures & Algorithms (DSA) Course - Clear Any FAANG Interview!,2022-01-06,2028364,1191,Jan
392,"Stacks and Queues Complete Tutorial - Theory + Implementation + Types (Dynamic, Circular)",2022-01-05,259063,1029,Jan
393,What is Chaos Engineering? Explained in 2 Minutes!,2022-01-03,10926,14,Jan
394,DevOps Bootcamp Announcement - Get 40+ LPA Base Package,2022-01-02,487565,866,Jan
395,I Got Reached Out By Google India - Why I Turned It Down,2021-12-31,73724,318,Dec
396,LinkedIn + Resume Tips by FAANG Recruiter,2021-12-30,27471,55,Dec
397,Navigate the CNCF Landscape with LearnScape,2021-12-29,3568,6,Dec
398,Prevent Kubernetes Misconfigurations from Reaching Production with Datree VS Code Extension,2021-12-28,4227,13,Dec
399,Solution to Career Confusion. How to Choose a Path?,2021-12-23,7796,39,Dec
400,What is Learning in Public - @AnaisUrlichs from @CivoCloud,2021-12-22,10399,22,Dec
401,Cloud Native Hackathon Closing Ceremony,2021-12-20,6567,10,Dec
402,Cloud Native Hackathon Rap,2021-12-13,6412,52,Dec
403,Why Developers Will Power The World,2021-12-11,6519,32,Dec
404,Navigating the cloud native ecosystem with Helm,2021-12-09,5956,13,Dec
405,Adding in-app AI voice assistant to your apps,2021-12-09,4549,6,Dec
406,Introduction to cloud native chaos engineering,2021-12-09,2299,5,Dec
407,Symbl.ai 101 - A conversation intelligence platform,2021-12-09,3502,5,Dec
408,Deploy your applications over Kubernetes in no-time,2021-12-09,2977,3,Dec
409,Hacking with Twilio: adding WhatsApp to your apps,2021-12-09,2515,3,Dec
410,Using Stream to build a team messaging app,2021-12-09,6508,7,Dec
411,Running an application on Civo Kubernetes,2021-12-09,3311,1,Dec
412,Set up your Kubernetes API resources quickly with Kusk,2021-12-09,1078,0,Dec
413,Test your Kubernetes application natively with TestKube,2021-12-09,2211,1,Dec
414,Get started with managing your K8s manifests with Monokle,2021-12-09,1123,2,Dec
415,How to achieve full situational awareness of your Kubernetes cluster with Lens,2021-12-09,1287,1,Dec
416,Access your computing resources with @goteleport,2021-12-09,969,1,Dec
417,How to use Datree to create a policy for Kubernetes,2021-12-09,1536,3,Dec
418,How to get started with tech communities,2021-12-09,3648,5,Dec
419,Chaos engineering for the community,2021-12-09,1051,4,Dec
420,Julia: the programming language for science,2021-12-09,1775,5,Dec
421,How writing technical blogs can take you places,2021-12-09,5691,3,Dec
422,Building your career in public,2021-12-09,3059,12,Dec
423,Get the job you want with open source,2021-12-09,10807,11,Dec
424,Building the future in cloud native,2021-12-09,2836,3,Dec
425,Building cloud skills with Battlesnake,2021-12-09,2980,9,Dec
426,You'll never walk alone - facing challenges together,2021-12-09,1913,21,Dec
427,How can students solve the challenges of an industry,2021-12-09,1916,4,Dec
428,Kicking off your career in cloud native,2021-12-09,4405,8,Dec
429,5 different ways to run Kubernetes clusters + learning resources,2021-12-09,4485,11,Dec
430,Welcome to the Cloud Native Hackathon,2021-12-09,9556,12,Dec
431,Network & Find Remote Jobs With Showwcase,2021-12-06,44493,141,Dec
432,What Is Developer Advocacy? By Kai from @CivoCloud,2021-12-04,5083,24,Dec
433,Complete Guide to Google Summer of Code (GSoC) by Mentors & Admins,2021-12-02,71230,98,Dec
434,Android Roadmap + Resources with Florian Walther from @codinginflow,2021-12-01,9969,63,Dec
435,DevOps Journey + Getting Remote Jobs via Open Source,2021-11-30,22021,77,Nov
436,Electrical Engineering to Data Analyst - Roadmap + Resources,2021-11-29,14772,83,Nov
437,5 Step Approach To Passing Any Technical Interview!,2021-11-28,6578,23,Nov
438,"Cloud Native Hackathon Announcement - Prizes Worth $12,000+ 🏆",2021-11-28,17321,70,Nov
439,How To Find Open Source Projects in ANY Domain - GSoC 2022,2021-11-27,69705,95,Nov
440,"Linked List Interview Questions - Google, Facebook, Amazon, Microsoft",2021-11-25,313611,607,Nov
441,How to Build a Startup - Podcast with Showwcase,2021-11-24,7232,33,Nov
442,Interview Tips From My Google Recruiter - Do's & Dont's,2021-11-22,61527,141,Nov
443,"Balance Work Life, Studies, and Open Source - by Cloud Native Peeps",2021-11-19,14881,49,Nov
444,How to Make Your Company Stand Out? By Shimon Tolts From Datree,2021-11-18,6027,24,Nov
445,Learn Kubernetes for FREE!,2021-11-17,56712,153,Nov
446,Why Pursue a Master's Degree?,2021-11-17,13072,56,Nov
447,Linked List Tutorial - Singly + Doubly + Circular (Theory + Code + Implementation),2021-11-16,565572,602,Nov
448,Remote DevOps Salary Comparisons - x3 of FAANG India (40+ LPA) 😱,2021-11-15,285139,1680,Nov
449,"OOP 7 | Collections Framework, Vector Class, Enums in Java",2021-11-14,99226,182,Nov
450,"OOP 6 | Generics, Custom ArrayList, Lambda Expressions, Exception Handling, Object Cloning",2021-11-13,147333,215,Nov
451,Failed IIT-JEE? 10 Tips to Make it BIG from Tier-3 College (40+ LPA Offers),2021-11-12,127520,983,Nov
452,"OOP 5 | Abstract Classes, Interfaces, Annotations",2021-11-10,158583,272,Nov
453,"OOP 4 | Access Control, In-built Packages, Object Class",2021-11-10,123076,162,Nov
454,"OOP 3 | Principles - Inheritance, Polymorphism, Encapsulation, Abstraction",2021-11-08,333309,863,Nov
455,How to Change Careers into Tech - with Brian Schuster from @IBM,2021-11-08,4725,23,Nov
456,"OOP 2 | Packages, Static, Singleton Class, In-built Methods",2021-11-05,303421,1030,Nov
457,"OOP 1 | Introduction & Concepts - Classes, Objects, Constructors, Keywords",2021-11-05,911358,1400,Nov
458,Learn and Win $7800+ in Prizes - @CivoCloud Hackathon + Newsletter Announcement,2021-11-03,9994,39,Nov
459,"N-Queens, N-Knights, Sudoku Solver (LeetCode) - Backtracking Questions",2021-11-02,110691,205,Nov
460,Is Competitive Programming Overrated to Get Jobs? Don't Waste Your Time!,2021-10-30,23996,90,Oct
461,Backtracking Introduction + Maze Problems - Theory + Code + Tips,2021-10-28,142128,254,Oct
462,"Recursion Google, Amazon Questions: Dice Throw & Letter Combinations of a Phone Number",2021-10-27,94493,197,Oct
463,12 Developer Tips to Not Get Hacked!,2021-10-25,6612,19,Oct
464,Are College Subjects Important? Answered by @kubesimplify​ from @CivoCloud,2021-10-24,10390,32,Oct
465,Datree Raffle Winners Announcement - MacBook Pro + Prizes Worth $7000! 🤩,2021-10-21,5062,15,Oct
466,Recursion - Permutations (Theory + Code + Tips),2021-10-21,109975,143,Oct
467,"Recursion Subset, Subsequence, String Questions",2021-10-20,223509,307,Oct
468,How to Manage Time and Tasks? Increase Your Productivity Like a Pro!,2021-10-20,8384,20,Oct
469,Managing GitHub Education and Campus Experts with Juan Pa (Program Manager),2021-10-18,4498,21,Oct
470,"Working at a Startup Vs Big Company by Mark Boost, CEO @CivoCloud​",2021-10-17,8626,17,Oct
471,Quick Sort Using Recursion (Theory + Complexity + Code),2021-10-16,130746,167,Oct
472,Merge Sort Using Recursion (Theory + Complexity + Code),2021-10-15,169317,247,Oct
473,How to Get Noticed by a Company Answered by @eddiejaoude,2021-10-15,12800,18,Oct
474,Learning in Public and Getting Opportunities with @AnaisUrlichs from @CivoCloud,2021-10-14,14205,44,Oct
475,Recursion - Pattern Questions + Bubble Sort + Selection Sort,2021-10-14,122617,200,Oct
476,Recursion - Array Questions (Theory + Code + Tips),2021-10-13,225079,376,Oct
477,Prevent Kubernetes Misconfigurations from Reaching Production with Datree,2021-10-07,75665,81,Oct
478,10 Mistakes to Avoid in College & Career - Only Guidance Video You Need,2021-10-06,53751,159,Oct
479,Recursion - Level 1 Questions (Theory + Code + Tips),2021-10-03,290303,628,Oct
480,Time Management Best Practices,2021-09-30,15703,76,Sep
481,Cloud Native Developer Advocacy with Kai from @CivoCloud,2021-09-28,3723,29,Sep
482,Maths for Data Structures & Algorithms,2021-09-25,195521,366,Sep
483,Prevent Kubernetes Misconfigurations from Reaching Production with Datree,2021-09-25,9400,75,Sep
484,Bitwise Operators + Number Systems - Maths for DSA,2021-09-23,293263,495,Sep
485,"Entrepreneur at the age of 15 - Shimon (CEO, Datree)",2021-09-23,5511,25,Sep
486,Remote Work Best Practices with Joe Nash (Part 2),2021-09-20,7355,30,Sep
487,College to DevRel Path with Joe Nash (Part 1),2021-09-19,7861,28,Sep
488,SWE to Cloud Roles with @kubesimplify from @CivoCloud  (Part 2),2021-09-17,6014,40,Sep
489,Time and Space Complexity COMPLETE Tutorial - What is Big O?,2021-09-16,515155,1243,Sep
490,College to Career with @kubesimplify from @CivoCloud (Part 1),2021-09-13,14281,62,Sep
491,Introduction to Recursion - Learn In The Best Way,2021-09-12,708505,1913,Sep
492,Solve Any Pattern Question With This Trick!,2021-09-12,2047547,1691,Sep
493,Binary Search in 2D Arrays,2021-09-11,227208,503,Sep
494,Thinking Out Loud in Open Source with Logan Kilpatrick,2021-09-10,8078,70,Sep
495,Backstory with Bart and Talks about @DoKcommunity,2021-09-08,6418,79,Sep
496,Strings and StringBuilder in Java,2021-09-07,320927,715,Sep
497,"Cycle Sort - Amazon, Google, Microsoft Interview Questions",2021-08-28,285276,1440,Aug
498,Travel the World while Working the Digital Nomad Way ✈️,2021-08-27,18313,116,Aug
499,How I Joined My Favourite Communities,2021-08-25,51080,119,Aug
500,How I Cleared My Google Interviews - Use LeetCode Effectively!,2021-08-24,632954,590,Aug
501,Insertion Sort Algorithm - Theory + Code,2021-08-23,169474,221,Aug
502,Selection Sort Algorithm - Theory + Code,2021-08-23,172727,176,Aug
503,Bubble Sort Algorithm - Theory + Code,2021-08-22,239210,419,Aug
504,25+ Paid Open Source Programs and Internships,2021-08-18,178002,416,Aug
505,"Binary Search Interview Questions - Google, Facebook, Amazon",2021-08-17,1049294,5734,Aug
506,Binary Search Algorithm - Theory + Code,2021-08-14,396209,596,Aug
507,GitHub Campus Experts 2021 Application Process,2021-08-13,31906,120,Aug
508,Linear Search Algorithm - Theory + Code + Questions,2021-08-12,573134,639,Aug
509,Introduction to Arrays and ArrayList in Java,2021-08-10,946077,911,Aug
510,What is Open Source & How to Start?,2021-08-10,314530,442,Aug
511,Functions / Methods in Java,2021-08-08,638982,656,Aug
512,Switch Statements + Nested Case in Java,2021-08-07,247350,318,Aug
513,Conditionals and Loops + Calculator Program,2021-08-06,545566,624,Aug
514,Gaming + Development - Podcast with Brad from Battlesnake,2021-08-05,7728,11,Aug
515,"First Java Program - Input/Output, Debugging and Datatypes",2021-08-03,928052,983,Aug
516,Introduction to Java - Architecture & Installation,2021-08-03,584742,724,Aug
517,Flow of Program - Flowcharts & Pseudocode,2021-08-02,457355,544,Aug
518,"Introduction to Programming - Types of Languages, Memory Management",2021-08-02,897079,1340,Aug
519,Complete Git and GitHub Tutorial,2021-08-01,1710073,1706,Aug
520,Introduction to Infrastructure as Code and Terraform,2021-08-01,14040,12,Aug
521,Java vs C++ for Data Structures & Algorithms,2021-07-29,510576,626,Jul
522,Introduction to Cloud Native Chaos Engineering,2021-07-18,11646,12,Jul
523,Engineering Student Productivity Desk Setup Tour (2021),2021-07-13,104170,193,Jul
524,Your Path to Non-Code Contributions in Kubernetes,2021-07-10,17292,25,Jul
525,The Startup Culture with Mark Boost from Civo,2021-07-05,22813,17,Jul
