,Title,Published_date,Views,Comments,Month
0,Simplify and Master Terraform at Any Scale with Terramate,2024-01-24,2594,18,Jan
1,Learn the Most Highly-Demanded AI Skills for FREE,2024-01-21,3392,2,Jan
2,Getting Started with Feature Flags with Flagsmith,2024-01-20,2757,9,Jan
3,Correct Binary Tree That Has Two Nodes Swapped - FAANG Interview Question,2023-12-31,10501,58,Dec
4,Convert Binary Tree to Doubly Linked List - FAANG Interview Question,2023-12-31,4191,25,Dec
5,Why I NEVER Took Notes While Learning to Code,2023-12-30,39264,122,Dec
6,Is It Worth Learning Java in 2024?,2023-12-22,16118,43,Dec
7,Learn and Build Infrastructure as Code with Pulumi AI,2023-12-22,3100,0,Dec
8,Maximising Developer Productivity in the AI Era,2023-12-20,5094,3,Dec
9,Application observability with Autometrics & Beyond,2023-12-06,3469,2,Dec
10,"Kth Smallest Element in a BST - Google, Amazon, Facebook Interview Question",2023-12-04,9790,60,Dec
11,"Two Sum IV - Google, Amazon, Facebook Interview Question",2023-12-04,4185,18,Dec
12,Unlocking the Future of Platform Engineering with Aiven - KubeCon NA 23,2023-12-03,2933,2,Dec
13,Word Ladder - LeetCode Hard - Google Phone Screen Interview Question,2023-11-30,7190,26,Nov
14,Vertical Order Traversal of a Binary Tree - Google Interview Question,2023-11-30,3939,17,Nov
15,Binary Tree from Preorder & Inorder Traversal - Advance Tree Questions,2023-11-30,9406,26,Nov
16,How to Manage and Control Kubernetes Applications Without Kubernetes Expertise,2023-11-30,3793,0,Nov
17,Easily Solve Range Query Interview Problems with Square Root Decomposition/Mo's Algorithm,2023-11-29,7529,40,Nov
18,Twingate's K8s-native Network Access [KubeCon NA 2023],2023-11-27,2745,2,Nov
19,Kubernetes Troubleshooting with Komodor [KubeCon NA 2023],2023-11-26,1810,2,Nov
20,New Age For Developers and Databases,2023-11-22,4043,6,Nov
21,Pulumi: Solving Infrastructure as Code Challenges [KubeCon NA 2023],2023-11-22,3799,7,Nov
22,How to Contribute to Java Open Source Projects,2023-11-21,30383,77,Nov
23,Mirantis' AppIQ for Intelligent Insights [KubeCon NA 2023],2023-11-20,851,4,Nov
24,Gloo Mesh Core: Advancements in Service Mesh [KubeCon NA 2023],2023-11-20,1326,2,Nov
25,AI Will Not Steal Your Job!,2023-11-19,39309,21,Nov
26,Aiven: The Future of Data Management [KubeCon NA 2023],2023-11-18,1820,3,Nov
27,Site24x7's AI-Powered Monitoring Solution [KubeCon NA 2023],2023-11-17,1371,4,Nov
28,Avesha: Multicloud Management Innovations [KubeCon NA 2023],2023-11-16,1550,2,Nov
29,Fiberplane's Observability in Code [KubeCon NA 2023],2023-11-16,1337,2,Nov
30,Observability in the Cloud Native Era - Why Is It Still so Hard? [KubeCon NA 2023],2023-11-16,1794,5,Nov
31,Identity Governance & Security with Teleport [KubeCon NA 2023],2023-11-15,800,2,Nov
32,Terramate: Enhancing Terraform's Capabilities [KubeCon NA 2023],2023-11-13,3887,9,Nov
33,Enhance Your Dev Workflow with Preview Environments,2023-11-02,5836,24,Nov
34,Spring Boot Tutorial with Project | Java Development Course,2023-11-01,95973,353,Nov
35,Answering Top 10 Open Source Questions With @eddiejaoude,2023-10-31,2978,6,Oct
36,Huffman Coding Greedy Algorithm | Text Compression,2023-10-30,12197,71,Oct
37,Why Is Kubernetes So Complex? How to Simplify!,2023-10-30,8450,14,Oct
38,Radix Sort Algorithm - Theory + Code,2023-10-30,7599,36,Oct
39,Count Sort Algorithm - Theory + Code,2023-10-29,7458,19,Oct
40,Karp-Rabin String Matching Algorithm | Substring Search Pattern,2023-10-29,9019,37,Oct
41,Introduction to HashMap & HashTable in Java,2023-10-29,31721,101,Oct
42,Introduction to Zero Trust Networking & Infra Access with Twingate,2023-10-21,3558,23,Oct
43,Configuration-as-Code: Automating Application Configuration,2023-10-20,2705,2,Oct
44,A Crash Course on SurrealDB,2023-10-13,4282,1,Oct
45,Decouple Deploy & Release: Deploying to Production Safely With Feature Flags,2023-10-06,3355,4,Oct
46,Headless Browsers,2023-10-05,3413,10,Oct
47,5 Questions You Should Ask About Your Data to Find the Right Tool,2023-10-04,2064,8,Oct
48,Does GSoC Help in Career? My Honest Experience,2023-10-02,21152,102,Oct
49,Full-stack Observability for DevOps,2023-09-29,4689,8,Sep
50,What Is Configuration-as-Code? Painless Configuration Management!,2023-09-29,6780,12,Sep
51,Simple Way to Host Your Websites & Projects,2023-09-27,8858,34,Sep
52,Introduction to Heap Data Structure + Priority Queue + Heapsort Tutorial,2023-09-24,36248,237,Sep
53,How to Find Remote Jobs?,2023-09-23,66751,188,Sep
54,How I Saved 100+ of Hours in College - Time Management Tips,2023-09-22,27273,113,Sep
55,How I Saved 100 Hours Pair Programming with This ChatGPT Alternative AI Tool,2023-09-21,6508,45,Sep
56,Use This Instead of ChatGPT! #coding,2023-09-19,17252,27,Sep
57,Cloud Cost Optimization Strategies - Reduce Your Cloud Bills,2023-09-18,4419,18,Sep
58,Introduction to API Gateway with Real World Examples,2023-09-15,13135,50,Sep
59,Collaboration and Team Feedback with Docker Compose,2023-09-15,3304,5,Sep
60,"Build, Ship & Maintain REST-Based APIs Faster",2023-09-14,8086,3,Sep
61,"Binary Tree Questions for Technical Interviews - Google, Facebook, Amazon, Microsoft",2023-09-01,87379,458,Sep
62,API Innovation Hackathon Announcement,2023-08-28,7491,30,Aug
63,Getting Started with Bite-size Otterize,2023-08-25,2782,8,Aug
64,How I Use AI to Quickly Learn Multiple Tech Stacks,2023-08-24,11216,63,Aug
65,Deploying Kafka Brokers in Multiple Clouds with KubeSlice,2023-08-22,3343,20,Aug
66,Cutting Cloud Costs with AI: Strategies to Reduce Your Spending,2023-08-21,2260,16,Aug
67,KubeHuddle Toronto Conference Vlog | Niagara Falls & Karaoke,2023-08-19,3767,23,Aug
68,How to Balance College + DSA + Development?,2023-08-18,68723,278,Aug
69,Secure Production With Just-in-time Access,2023-08-15,4459,19,Aug
70,GitHub Universe Vlog | I Met David J. Malan From CS50!,2023-08-13,7246,22,Aug
71,Efficient Software Development with Feature Flags,2023-08-12,4999,11,Aug
72,How to Get Your First Backend/DevOps Job,2023-08-11,10275,38,Aug
73,"DeveloperWeek Conference Highlights | Oakland, California",2023-08-10,8824,11,Aug
74,How Magical AI Saves Me Hours by Automating Tasks!,2023-08-10,10282,44,Aug
75,A Tech Conference Full of Dogs! 🐶 Paw Therapy at KubeCon,2023-08-10,7867,3,Aug
76,TechMids Birmingham Conference Vlog,2023-08-09,1886,6,Aug
77,How He Moved From TCS/Service to Product Based Company via Remote Jobs,2023-08-08,48561,94,Aug
78,Inside Google's New York Office With @KevinNaughtonJr,2023-08-07,25285,41,Aug
79,"DeveloperWeek Conference Vlog | Oakland, California with @dianasoyster_",2023-08-06,5148,17,Aug
80,KubeCon Valencia Conference Vlog,2023-08-05,3454,18,Aug
81,File Handling in Java Complete Course,2023-08-04,42382,158,Aug
82,I Spoke at Google's London Office | Meeting @eddiejaoude | Day in Life Vlog,2023-08-03,27115,84,Aug
83,Career Tips by Tech Mom Cortney,2023-08-02,7172,16,Aug
84,KubeCon Amsterdam Conference Vlog,2023-08-01,3837,35,Aug
85,DevOps Platform That Dev and Infra Teams Love,2023-08-01,17435,10,Aug
86,BigInteger & BigDecimal - Handling Large Numbers in Java,2023-07-31,13369,95,Jul
87,StringBuffer in Java | Data Formatting | Working With Large Data,2023-07-30,20914,89,Jul
88,Segment Trees Tutorial | Range Queries | Interview Questions,2023-07-28,26510,135,Jul
89,Why Developers Should Use Preview Environments,2023-07-26,3133,17,Jul
90,Create APIs Faster With Syncloop,2023-07-25,4304,10,Jul
91,AVL Trees Tutorial | Self Balancing Binary Search Trees,2023-07-24,41608,271,Jul
92,Simplifying Working With Kubernetes,2023-07-23,25767,13,Jul
93,Multi-cluster Management With KubeSlice,2023-07-23,4034,22,Jul
94,Chatting With the Battlesnake Team at Hackcon in New York,2023-07-22,3478,3,Jul
95,Code Without a Powerful Laptop!,2023-07-20,57695,32,Jul
96,Frontend to Full-stack Developer,2023-07-19,106620,81,Jul
97,Collaborative Troubleshooting and Monitoring in K8s With Botkube,2023-07-17,3241,10,Jul
98,Harnessing ChatGPT-Like Tools for Kubernetes,2023-07-16,2685,14,Jul
99,Simplifying Working with Kubernetes with Napptive,2023-07-15,1748,6,Jul
100,What's New in Monokle?,2023-07-14,1462,4,Jul
101,Why You Need to Think About Microservice Security,2023-07-13,1387,2,Jul
102,Students when they realise 50 LPA CTC != in-hand salary,2023-07-12,26024,45,Jul
103,A Multiplayer Game Where Your Code is the Controller,2023-07-12,2237,14,Jul
104,How to Level Up as a Developer?,2023-07-10,4284,12,Jul
105,My Remote Work Setup Tour [2023],2023-07-09,34070,264,Jul
106,Kubernetes Cost Saving and Resource Optimization,2023-07-04,5173,4,Jul
107,Exploring the Future of AI-Driven Code Review Tools,2023-07-02,4312,17,Jul
108,Top 5 Reasons to Use Proxies! How to Pick the Right Provider?,2023-07-01,5146,29,Jul
109,AI Code Review Tools - Open Source Productivity!,2023-06-30,13762,41,Jun
110,Open Source Course Launch [FREE],2023-06-29,137437,590,Jun
111,Unlock the Power of Botkube: ChatOps for Kubernetes,2023-06-28,2362,5,Jun
112,5 Tips to Break into Tech Without a College Degree,2023-06-25,10937,42,Jun
113,Community Tips by Jono Bacon,2023-06-24,2392,11,Jun
114,Zero RTO for Kubernetes Disaster Recovery with KubeSlice,2023-06-24,3108,5,Jun
115,Simplified Cloud-native Application Deployment with Napptive Playground and KubeVela,2023-06-22,2367,10,Jun
116,Interview with the Creators of GitHub Copilot,2023-06-19,27633,78,Jun
117,Career Tips by David J. Malan from CS50,2023-06-15,228279,247,Jun
118,How to Get a Tech Job Without a Degree with @JuliaFMorgado,2023-06-13,18596,47,Jun
119,Discussing Freelancing & Open Source with @francescociulla in Poland,2023-06-12,14213,51,Jun
120,5 Ways Hackathons Help in Getting Remote Jobs,2023-06-07,21300,23,Jun
121,2 Key Points for Getting a Job in Tech with @JuliaFMorgado,2023-06-06,23286,32,Jun
122,Binary Trees Tutorial - Introduction + Traversals + Code | Binary Search Trees (BST),2023-06-01,170294,723,Jun
123,Let's Talk About the Gopher in the Room,2023-05-31,4133,5,May
124,Create an Internal Developer Portal in 3 Steps [KubeCon + CNC EU 23],2023-05-30,1970,4,May
125,Discord Bot Tutorial - Code and Deploy Projects from Web Browser,2023-05-29,8529,25,May
126,5 Reasons Why Your Cloud Bills Are High [KubeCon + CNC EU 23],2023-05-28,1589,12,May
127,What's New with Access Control? [OSS NA 23],2023-05-27,1435,5,May
128,Is Kubernetes Troubleshooting Hard? [KubeCon + CNC EU 23],2023-05-26,2206,10,May
129,Is DevOps Dead? What Is Platform Engineering? [KubeCon + CNC EU 23],2023-05-25,7922,9,May
130,Who Are the CNCF Ambassadors? [KubeCon + CNC EU 23],2023-05-24,1611,10,May
131,3 Ways to Manage Policies at Scale [OSS NA 23],2023-05-23,1608,5,May
132,Top 5 Kubernetes Security Mistakes [KubeCon + CNC EU 23],2023-05-22,2673,11,May
133,Testkube - Your Cloud-Native Testing Framework for Kubernetes [KubeCon + CNC EU 23],2023-05-21,3047,3,May
134,Challenges With Network Policies [KubeCon + CNC EU 23],2023-05-20,1372,3,May
135,3 Ways Not to Get Hacked [KubeCon + CNC EU 23],2023-05-19,1578,3,May
136,How to Become a DevRel? The 5 Cs [KubeCon + CNC EU 23],2023-05-18,5472,9,May
137,3 Ways How Kubernetes IDE Lens Helps Developers [KubeCon + CNC EU 23],2023-05-17,2088,7,May
138,How to Find a Mentor in Tech & Grow Your Career [KubeCon + CNC EU 23],2023-05-16,7247,35,May
139,How to Get Jobs & Travel the World by Blogging,2023-05-13,97399,55,May
140,Join Me at Kubehuddle in Toronto! Keynote Announcement,2023-05-12,14261,50,May
141,I’ll be keynoting at cdCon + GitOpsCon in Canada 🇨🇦,2023-05-02,23352,25,May
142,Empowering Developers: The Impact of Internal Developer Platforms With @the_good_guy,2023-05-01,4485,24,May
143,The Future of Coding: Using AI to Code 100X Faster,2023-04-29,28487,73,Apr
144,How He Earned Money & Landed an Internship | A Guide to Bounty Hunting,2023-04-28,16708,44,Apr
145,Save Hours & Blog with Confidence Using Hashnode AI + GPT-4,2023-04-27,5863,26,Apr
146,[FREE Certified Digital Badges] API Security Testing for Developers & Testers,2023-04-26,6571,20,Apr
147,No-code Internal Developer Portals - Backstage Got Competition!,2023-04-25,6130,22,Apr
148,Get Premium DevOps Courses for FREE - Limited Time Offer,2023-04-24,150939,72,Apr
149,From Blog to Job: How Blogging Can Boost Your Tech Career!,2023-04-23,11578,61,Apr
150,The Pros & Cons of Using ChatGPT for Projects,2023-04-20,6886,39,Apr
151,Enhance Your DevOps Skills for FREE! Monitoring Done Right ✅,2023-04-18,12455,27,Apr
152,"Napptive Hackathon Livestream - QnA, Demos & More!",2023-04-14,4208,4,Apr
153,Simplify Kubernetes Cluster Mapping the Open Source Way,2023-04-14,4553,21,Apr
154,Picking the Right Cloud Cost Management System,2023-04-13,3170,44,Apr
155,Easiest Web Scraping Tutorial With Booking.com! Goodbye Proxies & Drivers 👋,2023-04-12,15867,39,Apr
156,What is the Role of AI in DevOps?,2023-04-11,5010,21,Apr
157,How to Manage & Reduce Kubernetes Waste - Twitter Space,2023-04-10,1172,9,Apr
158,What I Am Looking Forward to in 2023 - Twitter Space,2023-04-09,7152,22,Apr
159,Moving Beyond Passwords! What Developers Need To Know - Twitter Space,2023-04-08,2080,7,Apr
160,Monitor K8s Applications Effortlessly at Scale With groundcover + eBPF,2023-04-06,5602,17,Apr
161,Hackathon Announcement - Build Cloud Native Apps! Prizes Worth $1200 + Internships 💰🤩,2023-04-05,14661,72,Apr
162,The State of Spring Report 2022 by @VMwareTanzu Summary,2023-04-04,4893,14,Apr
163,Breaking Up With Network Policies - Developers Deserve Better!,2023-03-29,3147,13,Mar
164,Tic Tac Toe Java Game in Under 15 Minutes,2023-03-28,73797,192,Mar
165,4 Reasons Why You Should Not Take Guidance From Youtube,2023-03-27,37923,331,Mar
166,How I Use ChatGPT for Blogging to Save Time & Build Personal Brand,2023-03-25,21727,77,Mar
167,Introduction to Open Application Model (OAM) + KubeVela,2023-03-23,3340,22,Mar
168,Shift Left Approach to API Security Testing,2023-03-22,3195,9,Mar
169,Earn Lakhs While Making Projects From Home,2023-03-21,138039,249,Mar
170,Top New Features of @goteleport v12 in 12 Minutes!,2023-03-20,2102,19,Mar
171,The No-code Approach to Internal Developer Portals,2023-03-20,3802,12,Mar
172,Secure Your Kubernetes Clusters With ChatGPT,2023-03-19,4804,11,Mar
173,Cloud Native Observability With eBPF,2023-03-18,3868,2,Mar
174,Announcing GitHub Octernships - Stipend 💰 + Mentorship + Open Source,2023-03-12,55235,162,Mar
175,Will AI Replace Programmers? Logan From OpenAI Answers ChatGPT Questions,2023-03-07,21187,77,Mar
176,Introducing Monokle Desktop 2.0: The Ultimate Productivity Tool,2023-03-06,6371,11,Mar
177,How Platform Engineering Empowers Developer Productivity,2023-03-05,5119,24,Mar
178,KubeCon Detroit Conference Vlog,2023-03-04,7985,27,Mar
179,Using eBPF in Observability - Rising Costs of APM,2023-03-02,3500,5,Mar
180,How Groundcover is Shaping the Future of Observability With eBPF,2023-02-28,3182,22,Feb
181,An Introduction to DevOps & Microservice Architecture,2023-02-27,12352,25,Feb
182,How to Get Involved in Global Communities? Step by Step Process!,2023-02-26,53966,127,Feb
183,Google Shuts Down Code Jam - End of Competitive Programming?,2023-02-25,74533,504,Feb
184,"WebAssembly, Open Source, Observability - Ask Us Anything #1",2023-02-22,5810,10,Feb
185,I Met Apple's Founder Steve Wozniak at @CivoCloud Navigate - Conference Vlog,2023-02-19,17024,67,Feb
186,What is Kubernetes? Wrong Answer Only!,2023-02-19,41346,33,Feb
187,I Met Steve Wozniak! Civo Navigate Highlights,2023-02-18,25354,22,Feb
188,The Stream team has some cool features to showcase at DeveloperWeek,2023-02-16,18659,5,Feb
189,Eliminate Infrastructure Clutter With Port at DeveloperWeek,2023-02-16,9856,3,Feb
190,Had a great chat with Allen Vailliencourt from @goteleport here at @CivoCloud Navigate!,2023-02-08,10709,1,Feb
191,"Stacks and Queues Interview Questions - Google, Facebook, Amazon, Microsoft",2023-02-04,102551,628,Feb
192,Should You Drop Out of College? @ApoorvGoyalMain 's Story,2023-01-25,15401,84,Jan
193,Open Source Will Change Hiring - Are You Ready?,2023-01-21,96202,381,Jan
194,One YAML to Rule Them All - Twitter Space,2023-01-16,3256,6,Jan
195,Become an Open Source Contributor Today - Twitter Space,2023-01-15,9605,29,Jan
196,Write & Ship Code Faster With Observability Driven Development,2023-01-06,5929,37,Jan
197,One Easy Way to Configure All Your Workloads,2023-01-05,8857,38,Jan
198,10 Data Collection Project Ideas & Demos,2023-01-04,6481,60,Jan
199,Battlesnake Gaming Tournament Live Stream #3,2022-12-28,7442,16,Dec
200,Best DevOps & Productivity Tools of 2022,2022-12-23,14908,33,Dec
201,Optimise Your Cloud Costs With CostGuard,2022-12-22,2931,9,Dec
202,Boost Security and Compliance Scanning With CIS Benchmarks,2022-12-21,2893,4,Dec
203,Battlesnake Gaming Tournament Live Stream #2,2022-12-19,8389,7,Dec
204,How to Grow an Open Source Project?,2022-12-19,15629,39,Dec
205,GitHub Headquarters Tour - San Francisco,2022-12-18,43332,64,Dec
206,Earning x4 of FAANG Working Remotely as a Student - How to Find Remote Jobs?,2022-12-16,121936,184,Dec
207,How to Practice Data Structures and Algorithms?,2022-12-15,84188,141,Dec
208,The Distributed Open Source Graph Database - NebulaGraph,2022-12-14,3218,12,Dec
209,WeMakeDevs & Stream Hackathon Announcement,2022-12-13,7347,29,Dec
210,Using Message Queues in Production with Lane from Boot.dev,2022-12-12,3726,20,Dec
211,Getting Started With Battlesnake Gaming Tournament - Step by Step Guide,2022-12-10,8845,18,Dec
212,Code Anywhere With This Mobile App,2022-12-09,7742,46,Dec
213,How to Become a Blockchain Developer | Complete Web3 Roadmap,2022-12-08,85425,599,Dec
214,Battlesnake Gaming Tournament Announcement - Exciting Prizes!,2022-12-07,3694,16,Dec
215,Perform Database Migration Using Github Actions & Supabase CLI,2022-12-06,6373,18,Dec
216,"DevOps as a Career - Prerequisites, Resources, Mentorship, & More!",2022-12-05,47955,63,Dec
217,AI Answers All Coding Questions! End of LeetCode?,2022-12-04,50422,171,Dec
218,Content Creation as a Developer - Get Remote Jobs!,2022-12-03,14429,45,Dec
219,"Configure All Your Workloads, Everywhere With Score.dev",2022-12-02,2436,15,Dec
220,Web Scraping Tutorial With Amazon Example,2022-12-01,15735,39,Dec
221,The Road to Upskilling With On Freund (Trywilco.com),2022-11-28,1990,18,Nov
222,Getting Remote Jobs via Open Source & Learning in Public,2022-11-26,22357,60,Nov
223,Why is It Important to Have a Developer Portfolio - Twitter Space,2022-11-25,6682,7,Nov
224,How to Attributed Cost Per Tenant in a Kubernetes Environment - Twitter Space,2022-11-24,1159,8,Nov
225,The State of the Software Supply Chain: Open Source Edition 2022 by @VMwareTanzu,2022-11-23,3875,14,Nov
226,Best Way to Start a Developer Blog in 2023? Land Remote Jobs!,2022-11-23,38137,62,Nov
227,Manage Your PRs & Tasks Directly From Slack With @Zigi AI,2022-11-22,3380,23,Nov
228,What is a Message Broker? - Twitter Space,2022-11-21,1887,3,Nov
229,College Passout Placement Roadmap - Brutally Honest,2022-11-19,62547,259,Nov
230,The Missing UI for Helm by Komodor - Visualize Your Releases,2022-11-17,4626,23,Nov
231,Git-enabled K8s Configuration Tool & Version Control Editor,2022-11-16,1606,6,Nov
232,Are Remote Jobs Secure?,2022-11-15,47492,261,Nov
233,Serverless Computing with OpenFunction,2022-11-12,4595,8,Nov
234,Talking Tech With Plural.sh [KubeCon + CNC NA 22],2022-11-08,4616,23,Nov
235,Share Your Kubecon Experience on Hashnode - Win Course Vouchers Worth $500!,2022-11-07,2710,15,Nov
236,Benefits of Using Multi-cloud [KubeCon + CNC NA 22],2022-11-04,7754,16,Nov
237,Build an Instagram Scraper With SOAX Residential Proxies,2022-11-02,12126,35,Nov
238,Build a Facebook Scraper With SOAX Residential Proxies,2022-10-29,7144,34,Oct
239,Great DevOps Learning Platform!,2022-10-25,49308,156,Oct
240,Introducing Helm-Dashboard - The Missing UI for Helm by Komodor,2022-10-24,3287,15,Oct
241,First Time KubeCon Attendee Guide,2022-10-23,7233,29,Oct
242,Monokle v1.11 & 1.12 Releases - Twitter Space,2022-10-22,1741,11,Oct
243,Monitor and Reduce Cloud Costs in Minutes With Finout,2022-10-21,7686,29,Oct
244,Observability Driven Development With Sprkl - Twitter Space,2022-10-20,1619,17,Oct
245,Self-hosting Kubernetes With Plural,2022-10-20,2106,14,Oct
246,Enforce Troubleshooting Best Practices With Komodor,2022-10-19,3100,25,Oct
247,Can You Earn 7 Lakhs Per Month Salary From India?,2022-10-18,139910,861,Oct
248,Open API Support Through Swagger in Kubescape,2022-10-18,4162,8,Oct
249,Container Image Registry Scanning With Kubescape,2022-10-17,4580,9,Oct
250,Automate Kubernetes Troubleshooting With Komodor,2022-10-16,5986,29,Oct
251,Do You Need Visa for Working Remotely?,2022-10-16,31633,140,Oct
252,Introduction to ZeroOps - Increase Your Productivity,2022-10-13,4934,30,Oct
253,See the Impact of Every Code Change in Your IDE With Sprkl,2022-10-12,2342,13,Oct
254,Internships & More With @DoKcommunity - Twitter Space,2022-10-07,6460,22,Oct
255,Kubescape Open Source Fest - MacBook Giveaway LIVE!,2022-10-06,8335,15,Oct
256,Attend KubeCon North America for Free - Student Scholarships,2022-10-03,8731,27,Oct
257,The Future of Merge Workflow With Julien From Mergify,2022-10-02,2661,15,Oct
258,How Zigi Cuts Cycle Time by ~75% From Days to Hours - Twitter Space,2022-09-28,2606,8,Sep
259,Batch Vs Stream Processing - How to Reduce Complexity?,2022-09-26,5118,18,Sep
260,Reducing Your Cloud Spend - Rise of FinOps,2022-09-24,3022,16,Sep
261,Cloud Native London Meetup - September 2022Cloud Native London Meetup - September 2022,2022-09-22,12137,22,Sep
262,Why It's Time Developers Get Help to Manage Their Day-to-day Tasks?,2022-09-20,3689,9,Sep
263,Discover Vulnerabilities Earlier in Your Development Cycle With Lens,2022-09-19,5387,17,Sep
264,Hacking & Protecting Kubernetes With @goteleport,2022-09-16,4741,10,Sep
265,Why Self-host Your Open-source Applications on Kubernetes? - Twitter Space,2022-09-12,4168,20,Sep
266,Benefits of Working Remotely - Work Life Balance & More!,2022-09-04,50661,264,Sep
267,Why I Skipped On-campus College Placements,2022-09-01,37099,188,Sep
268,Build a Twitter Scraper With SOAX Residential Proxies,2022-08-27,10708,29,Aug
269,@WeMakeDevs Delhi Meetup Highlights,2022-08-23,33034,127,Aug
270,"Get $1500 Stipend, MacBooks, Swag & Remote Jobs - Open Source Fest Announcement",2022-08-22,40084,45,Aug
271,Scanning K8s Repositories for Vulnerabilities With Kubescape,2022-08-22,5115,6,Aug
272,GitOps Powered Kubernetes Testing With Testkube + Argo CD,2022-08-21,6511,14,Aug
273,Securing Kubernetes YAML With ValidKube + Kubescape,2022-08-20,5838,12,Aug
274,How @CSDojo Grew His Youtube Channel to Millions,2022-08-19,5524,16,Aug
275,Faster and Safer Code Merge With Mergify,2022-08-18,6538,30,Aug
276,Introduction to Nhost - the Firebase Alternative? React Tutorial,2022-08-17,7383,23,Aug
277,Cloud Native Testing With Testkube - Twitter Space,2022-08-16,2410,15,Aug
278,Kubernetes Security With Kubescape - Twitter Space,2022-08-15,2035,5,Aug
279,Introduction to Chaos Engineering With @litmuschaos6738,2022-08-14,2980,14,Aug
280,How I Learn New Things - Be More Efficient 💡,2022-08-13,40280,131,Aug
281,State of Observability 2022 by VMware Tanzu Summary,2022-08-12,2425,10,Aug
282,The Common Trait Among High Achievers in Tech with @RahulPandeyrkp,2022-08-11,8714,35,Aug
283,Journey as a CTO - Shem Magnezi From Wilco,2022-08-10,2757,17,Aug
284,Running a Backend as a Service Company - Johan Eliasson From Nhost,2022-08-09,3106,22,Aug
285,Swag Giveaway! 🤩 GitHub Open Source Social Circle by Sema,2022-08-08,7433,40,Aug
286,"Kubernetes the ""Easy"" Way - Twitter Space",2022-08-07,4011,18,Aug
287,How to Find Remote Jobs While Learning in Public With @francescociulla,2022-08-06,37831,91,Aug
288,Kunal Kushwaha Live Stream,2022-08-05,0,0,Aug
289,Fourth Year College Roadmap (BTech/BCA),2022-08-05,26191,172,Aug
290,Third Year College Roadmap (BTech/BCA),2022-08-04,56297,175,Aug
291,Making Permissions Accessible to Anyone With Permit.io,2022-08-03,2634,12,Aug
292,The Future of CS Education - Twitter Space,2022-08-02,7524,31,Aug
293,"Practice Your Coding Skills With Wilco - Prizes Worth ₹125,000 🎉",2022-08-01,19604,87,Aug
294,Learn Anything for Free & Get High Paying Jobs - Huge Announcement!,2022-07-31,274799,1641,Jul
295,Open Source Best Practices With ValidIac - Twitter Space,2022-07-30,2623,17,Jul
296,Microsoft India 50 LPA CTC Breakdown - Shocking Reality! 🤯,2022-07-29,156118,870,Jul
297,Testkube - The Kubernetes-native Testing Framework,2022-07-28,8220,30,Jul
298,Cloud Asset Management With Firefly,2022-07-27,4908,28,Jul
299,Best Way to Learn Backend Development and Get a Remote Job?,2022-07-25,46198,74,Jul
300,Measuring Argo Workflow Costs With Kubecost,2022-07-24,3573,18,Jul
301,Infrastructure as Code with @PulumiTV - Twitter Space,2022-07-23,1838,9,Jul
302,How I Use My Monitor to Enhance Coding Productive,2022-07-22,29212,42,Jul
303,How to Prepare for Experiential Interviews - Twitter Space,2022-07-21,3843,14,Jul
304,What is Everything as Code and How to Get Started?,2022-07-20,3231,6,Jul
305,The Best Way to Become a Backend Software Engineer,2022-07-19,16404,53,Jul
306,Backend as a Service and How to Ship Products Faster - Twitter Space,2022-07-18,5765,9,Jul
307,DevOps as a Career for New Grads With @TechWorldwithNana,2022-07-17,26926,93,Jul
308,Introduction to @PulumiTV - Infrastructure as Code (IaC) in Programming Languages,2022-07-16,8644,25,Jul
309,Monitor Your Cloud and Kubernetes Spend Using OpenCost,2022-07-15,3104,7,Jul
310,Introduction to OPAL - Real-time Dynamic Authorization,2022-07-14,5986,22,Jul
311,Evolution of DevOps With @PulumiTV,2022-07-13,3207,14,Jul
312,How to Understand Your API Quickly by Swagger,2022-07-12,3160,13,Jul
